title,developer,publisher,release_date,age_in_days,tags,description,price,recent_reviews,all_reviews
Cat God Ranch,CrazyPotato Studio,CrazyPotato Studio,2024-09-12,38,"['Roguelike Deckbuilder', 'Deckbuilding', 'Casual', 'Roguelike', 'Replay Value', 'Roguelite', 'Farming', 'Strategy', 'Resource Management', 'Auto Battler', 'Card Game', 'Cute', 'Creature Collector', 'Singleplayer', 'Turn-Based', 'Relaxing', 'Management', '2D', 'Choices Matter', 'Simulation']","Lead hundreds of ""wise"" little animals to pay tribute to the Cat God!! 7 animal families, 100+ animals, 10+ Cat Gods, 100+ items, and various animal combinations waiting for you to explore!",90999,"{'summary': 'Very Positive', 'count': '603', 'info': '- 93% of the 603 user reviews in the last 30 days are positive.'}","{'summary': 'Very Positive', 'count': '904', 'info': '- 93% of the 904 user reviews for this game are positive.'}"
Euro Truck Simulator 2 - Kögel Trailer Pack,SCS Software,SCS Software,2024-09-05,45,"['Indie', 'Simulation']",Description not found,37999,"{'summary': 'Mostly Positive', 'count': '102', 'info': '- 73% of the 102 user reviews for this game are positive.'}","{'summary': 'Mostly Positive', 'count': '102', 'info': '- 73% of the 102 user reviews for this game are positive.'}"
Living With Sister: Monochrome Fantasy,Inusuku,Kagura Games,2024-03-22,212,"['Sexual Content', 'Hentai', 'Nudity', 'Cute', 'Mature', 'NSFW', 'Anime', 'FPS', 'RPG', 'JRPG', '2D', 'Funny', 'Singleplayer', 'Indie', 'Visual Novel', 'Dating Sim', 'Simulation', 'Psychological Horror', 'Souls-like', 'Family Friendly']","When your father goes off on an adventure, it's up to you to keep the lights on and take care of your sister.",114999,"{'summary': 'Overwhelmingly Positive', 'count': '316', 'info': '- 95% of the 316 user reviews in the last 30 days are positive.'}","{'summary': 'Overwhelmingly Positive', 'count': '6,666', 'info': '- 96% of the 6,666 user reviews for this game are positive.'}"
The Nameless: Slay Dragon,The Nameless Epic,WhisperGames,2024-09-26,24,"['RPG', 'Adventure', 'Turn-Based Combat', 'Story Rich', 'Dark Fantasy', 'Strategy', 'CRPG', 'JRPG', 'Class-Based', 'Choices Matter', 'Strategy RPG', 'Choose Your Own Adventure', 'Exploration', 'Turn-Based Strategy', 'Multiple Endings', 'Dragons', '2D', 'Visual Novel', 'Anime', 'Fantasy']","The Nameless: Slay Dragon is a gamebook-adventure flavored turn-based RPG In short - how to slay the immensely powerful and cunning evil dragon? You will play as a young man having a bloody feud with a dragon, and face powerful, sinister and tricky enemies with friends....",152999,"{'summary': 'Very Positive', 'count': '827', 'info': '- 91% of the 827 user reviews for this game are positive.'}","{'summary': 'Very Positive', 'count': '827', 'info': '- 91% of the 827 user reviews for this game are positive.'}"
Unturned,Smartly Dressed Games,Smartly Dressed Games,2017-07-07,2662,"['Free to Play', 'Survival', 'Zombies', 'Multiplayer', 'Open World', 'Co-op', 'Sandbox', 'Crafting', 'Shooter', 'Adventure', 'Post-apocalyptic', 'First-Person', 'Looter Shooter', 'Singleplayer', 'FPS', 'Action', 'Massively Multiplayer', 'Indie', 'Atmospheric', 'Casual']","You're a survivor in the zombie infested ruins of society, and must work with your friends and forge alliances to remain among the living.",0,"{'summary': 'Very Positive', 'count': '1,835', 'info': '- 89% of the 1,835 user reviews in the last 30 days are positive.'}","{'summary': 'Very Positive', 'count': '546,959', 'info': '- 91% of the 546,959 user reviews for this game are positive.'}"
Beltmatic,Notional Games,Notional Games,2024-03-29,205,"['Automation', 'Casual', 'Base Building', 'Sandbox', 'Resource Management', 'Simulation', 'Strategy', 'Crafting', 'Idler', '2D', 'Minimalist', 'Abstract', 'Top-Down', 'Building', 'Family Friendly', 'Relaxing', 'Indie', 'Open World', 'Singleplayer']",Beltmatic is a casual factory game where you combine numbers using mathematical operations.,65000,"{'summary': 'Very Positive', 'count': '85', 'info': '- 94% of the 85 user reviews in the last 30 days are positive.'}","{'summary': 'Very Positive', 'count': '833', 'info': '- 94% of the 833 user reviews for this game are positive.'}"
Easy Red 2,Marco Amadei,Corvostudio di Amadei Marco,2020-11-10,1440,"['World War II', 'Action', 'Singleplayer', 'FPS', 'Simulation', 'Indie', 'Strategy', 'Multiplayer', 'Gore', 'Violent', 'War', 'Sandbox', 'Shooter', 'Realistic', 'Atmospheric', 'Wargame', 'Historical', 'Immersive Sim', 'Team-Based', 'First-Person']","Fight massive battles between infantry, armored vehicles, tanks, cannons and planes. Realistically manage your weapons and equipment, coordinate with your squad, and tactically navigate large, fully destructible open world maps. Experience the WW2 in singleplayer, PVP and Co-Op.",79990,"{'summary': 'Overwhelmingly Positive', 'count': '121', 'info': '- 95% of the 121 user reviews in the last 30 days are positive.'}","{'summary': 'Very Positive', 'count': '4,851', 'info': '- 90% of the 4,851 user reviews for this game are positive.'}"
American Truck Simulator - New Mexico,SCS Software,SCS Software,2017-11-09,2537,"['Simulation', 'Indie', 'Open World', 'Driving', 'America', 'Multiplayer', 'Realistic', 'Singleplayer', 'Adventure']",Description not found,109999,"{'summary': 'Very Positive', 'count': '933', 'info': '- 93% of the 933 user reviews for this game are positive.'}","{'summary': 'Very Positive', 'count': '933', 'info': '- 93% of the 933 user reviews for this game are positive.'}"
Doki Doki Literature Club Plus!,Team Salvato,Serenity Forge,2021-06-30,1208,"['Psychological Horror', 'Visual Novel', 'Anime', 'Dating Sim', 'Sexual Content', 'Cute', 'Romance', 'Story Rich', 'Multiple Endings', 'Gore', 'Singleplayer', '2D', 'Violent', 'Interactive Fiction', 'Text-Based', 'Conversation', 'Dark Humor', 'Indie', 'Casual', 'Choose Your Own Adventure']",Welcome to the club! Write poems for your crush and experience the terror of school romance in this critically-acclaimed psychological horror story.,153640,"{'summary': 'Overwhelmingly Positive', 'count': '261', 'info': '- 95% of the 261 user reviews in the last 30 days are positive.'}","{'summary': 'Overwhelmingly Positive', 'count': '23,067', 'info': '- 96% of the 23,067 user reviews for this game are positive.'}"
Five Nights at Freddy's,Scott Cawthon,Scott Cawthon,2014-08-18,3716,"['Horror', 'Singleplayer', 'Survival Horror', 'Robots', 'Psychological Horror', 'Indie', 'Difficult', 'First-Person', 'Point & Click', 'Dark', 'Survival', 'Atmospheric', 'Mouse only', 'Jump Scare', 'Supernatural', 'Resource Management', 'Lore-Rich', 'Silent Protagonist', 'Short', 'Historical']","Welcome to your new summer job at Freddy Fazbear's Pizza, where kids and parents alike come for entertainment and food! The main attraction is Freddy Fazbear, of course; and his two friends. They are animatronic robots, programmed to please the crowds!",39999,"{'summary': 'Overwhelmingly Positive', 'count': '353', 'info': '- 95% of the 353 user reviews in the last 30 days are positive.'}","{'summary': 'Very Positive', 'count': '44,878', 'info': '- 93% of the 44,878 user reviews for this game are positive.'}"
Idling to Rule the Gods,Shugasu GmbH,Shugasu GmbH,2016-05-27,3068,"['Free to Play', 'Simulation', 'Indie', 'Casual', 'Singleplayer', 'Text-Based', 'Strategy', 'God Game', 'Clicker', 'Management', 'Fantasy', 'Anime', 'RPG', 'Time Management', '2D', 'Idler', 'Mythology', 'Funny', 'Sci-fi', 'Supernatural']","Idling to Rule the Gods is a free to play Idle-Game with a lot of content and some Minigames. Depending on your play-style, you can play it fast or slow. Either way it can be fun for hundreds of hours!",0,"{'summary': 'Mostly Positive', 'count': '23', 'info': '- 78% of the 23 user reviews in the last 30 days are positive.'}","{'summary': 'Very Positive', 'count': '1,756', 'info': '- 86% of the 1,756 user reviews for this game are positive.'}"
The Jackbox Party Pack 9,"Jackbox Games, Inc.","Jackbox Games, Inc.",2022-10-19,732,"['Casual', 'Trivia', 'Board Game', 'Word Game', '2D', 'Comedy', 'Family Friendly', 'Party Game', 'Party', 'Local Multiplayer', 'Cartoon', 'Colorful', 'Funny', 'PvP', 'Team-Based', 'Local Co-Op', 'Indie', 'Strategy', 'Co-op', 'Multiplayer']","Save your next party! 5 new games in 1 Party Pack: the trivia bluff-off Fibbage 4, the team test Quixort, the joke auction Junktopia, the silly guessfest Nonsensory and the reality TV game Roomerang.",245999,"{'summary': 'Very Positive', 'count': '10', 'info': '- 80% of the 10 user reviews in the last 30 days are positive.'}","{'summary': 'Very Positive', 'count': '521', 'info': '- 84% of the 521 user reviews for this game are positive.'}"
Regiments,Bird's Eye Games,MicroProse Software,2022-08-16,796,"['Strategy', 'Wargame', 'Real Time Tactics', 'Cold War', 'Combat', 'RTS', 'Realistic', 'Tactical', 'Alternate History', 'Singleplayer', 'War', '1980s', 'Modern', 'Military', 'Tanks', 'Simulation', 'Indie', '3D', 'Choices Matter', 'PvE']","Regiments is a Real-Time Tactics game set in Germany 1989. The Cold War has gone hot, and the inferno is raging. Lead your Regiment through the fires of conflict and the fog of war. Break through the lines, call in artillery, maneuver, feign retreats, stage defenses, counter-attack. Do not relent.",139999,"{'summary': 'Very Positive', 'count': '29', 'info': '- 89% of the 29 user reviews in the last 30 days are positive.'}","{'summary': 'Very Positive', 'count': '2,326', 'info': '- 87% of the 2,326 user reviews for this game are positive.'}"
Ship Graveyard Simulator 2,Games Incubator,Games Incubator,2023-08-16,431,"['Simulation', 'Destruction', 'Multiplayer', 'Online Co-Op', 'Exploration', 'Management', 'Realistic', 'Building', 'First-Person', 'Indie', 'Action', 'Relaxing', 'Casual', 'Sandbox', 'Inventory Management', 'Atmospheric', 'Family Friendly', 'Adventure', 'Crafting', 'Education']","Dust off your torch and hammer - it's time to get back to work, you have a new job to do. Visit the new beach coast with the largest, biggest ship graveyard in the world, dismantle huge ship parts and collect tons of precious steel. Roll up your sleeves, it's time to get back to the business.",206999,"{'summary': 'Mostly Positive', 'count': '47', 'info': '- 78% of the 47 user reviews in the last 30 days are positive.'}","{'summary': 'Very Positive', 'count': '1,847', 'info': '- 80% of the 1,847 user reviews for this game are positive.'}"
Grim Dawn - Ashes of Malmouth Expansion,Crate Entertainment,Crate Entertainment,2017-10-11,2566,"['RPG', 'Action', 'Adventure', 'Hack and Slash', 'Indie', 'Action RPG', 'Loot', 'Co-op', 'Dark Fantasy', 'Lovecraftian', 'Dungeon Crawler', 'Isometric']",Description not found,104999,"{'summary': 'Very Positive', 'count': '1,340', 'info': '- 90% of the 1,340 user reviews for this game are positive.'}","{'summary': 'Very Positive', 'count': '1,340', 'info': '- 90% of the 1,340 user reviews for this game are positive.'}"
Shattered Pixel Dungeon,Shattered Pixel,Shattered Pixel,2022-03-23,942,"['Traditional Roguelike', 'Dungeon Crawler', 'Roguelike', 'Turn-Based', 'RPG', 'Mystery Dungeon', 'Perma Death', 'Indie', '2D', 'Difficult', 'Procedural Generation', 'Replay Value', 'Pixel Graphics', 'Fantasy', 'Turn-Based Combat', 'Adventure', 'Top-Down', 'Loot', 'Singleplayer', 'Crafting']","Shattered Pixel Dungeon is a traditional roguelike dungeon crawler that's simple to start but hard to master! Every game is a unique challenge, with five different heroes, randomized levels and enemies, and hundreds of items to collect and use.",28499,"{'summary': 'Very Positive', 'count': '40', 'info': '- 100% of the 40 user reviews in the last 30 days are positive.'}","{'summary': 'Overwhelmingly Positive', 'count': '1,272', 'info': '- 95% of the 1,272 user reviews for this game are positive.'}"
Smalland: Survive the Wilds,Merge Games,Merge Games,2024-02-15,248,"['Survival', 'Open World Survival Craft', 'Multiplayer', 'Base Building', 'Online Co-Op', 'Building', 'Open World', 'Crafting', 'Co-op', 'Exploration', 'Singleplayer', 'Sandbox', 'Adventure', 'RPG', 'Character Customization', 'Action-Adventure', 'Third Person', 'First-Person', 'City Builder', 'Action']","Experience a big adventure on a tiny scale! Enjoy multiplayer survival in a vast, hazardous world. Preparation is key when you're this small & at the bottom of the food chain. Craft weapons & armour, tame & ride creatures, build encampments & explore a strange new land.",284999,"{'summary': 'Mostly Positive', 'count': '142', 'info': '- 71% of the 142 user reviews in the last 30 days are positive.'}","{'summary': 'Very Positive', 'count': '5,822', 'info': '- 83% of the 5,822 user reviews for this game are positive.'}"
"PowerWash Simulator – Warhammer 40,000 Special Pack",FuturLab,Square Enix,2024-02-27,236,"['Indie', 'Casual', 'Simulation', 'Warhammer 40K', 'Wholesome', 'Cozy', 'First-Person', 'Immersive Sim', 'Relaxing', 'Immersive', 'Atmospheric', 'Singleplayer', 'Addictive', '3D', 'Cartoon', 'Co-op', 'Multiplayer', '2D', 'Nostalgia', 'Job Simulator']",Description not found,112000,"{'summary': 'Mixed', 'count': '16', 'info': '- 68% of the 16 user reviews in the last 30 days are positive.'}","{'summary': 'Mixed', 'count': '283', 'info': '- 42% of the 283 user reviews for this game are positive.'}"
Per Aspera,Tlön Industries,Raw Fury,2020-12-03,1417,"['Online Co-Op', 'Moddable', 'Management', 'Multiplayer', 'Automation', 'Robots', 'Base Building', 'Resource Management', 'City Builder', 'Sandbox', 'Colony Sim', 'Simulation', 'Strategy', 'Mars', 'Survival', 'Building', 'Sci-fi', 'Space', 'Science', 'Co-op']",Make Mars your own! Take control of the world’s most sophisticated AI (AMI) and terraform the surface of the Red Planet for a city-building experience on a planetary scale. Transform this barren world into a lush paradise and explore the surface for any ancient secrets that may be waiting.,73747,"{'summary': 'Mostly Positive', 'count': '3,697', 'info': '- 76% of the 3,697 user reviews for this game are positive.'}","{'summary': 'Mostly Positive', 'count': '3,697', 'info': '- 76% of the 3,697 user reviews for this game are positive.'}"
Hero's Adventure - Her Vanishing Silhouette,半瓶醋工作室（Half Amateur Studio）,半瓶醋工作室（Half Amateur Studio）,2024-08-13,68,"['RPG', 'Indie', 'Adventure', 'Simulation', 'Martial Arts', 'Open World', 'Multiple Endings', 'Strategy', 'Pixel Graphics', 'Turn-Based Strategy', 'Singleplayer', 'Turn-Based', 'Stealth', 'Choose Your Own Adventure', '2D', 'Drama', 'Sexual Content', 'Anime', 'RPGMaker', 'Mature']",Description not found,37999,"{'summary': 'Mostly Negative', 'count': '14', 'info': '- 35% of the 14 user reviews in the last 30 days are positive.'}","{'summary': 'Mostly Positive', 'count': '126', 'info': '- 71% of the 126 user reviews for this game are positive.'}"
Project Hospital,Oxymoron Games,Oxymoron Games,2018-10-30,2182,"['Medical Sim', 'City Builder', 'Job Simulator', 'Management', 'Simulation', 'Strategy', 'Education', 'Sandbox', 'Building', 'Economy', 'Life Sim', 'Character Customization', '2D', 'Isometric', 'Realistic', 'Stylized', 'Moddable', 'Indie', 'Replay Value', 'Resource Management']","Become an ace doctor, an aspiring architect and a successful manager at the same time. Design your very own hospital, tweak every detail or choose one of the prebuilt scenarios and just jump to the doctor’s duty.",200000,"{'summary': 'Very Positive', 'count': '59', 'info': '- 91% of the 59 user reviews in the last 30 days are positive.'}","{'summary': 'Very Positive', 'count': '6,958', 'info': '- 88% of the 6,958 user reviews for this game are positive.'}"
Oxygen Not Included - Spaced Out!,Klei Entertainment,Klei Entertainment,2021-12-16,1039,"['Simulation', 'Indie', 'Colony Sim', 'Base Building', 'Management', 'Space', '2D', 'Survival', 'Singleplayer']",Description not found,83999,"{'summary': 'Mostly Positive', 'count': '1,093', 'info': '- 79% of the 1,093 user reviews for this game are positive.'}","{'summary': 'Mostly Positive', 'count': '1,093', 'info': '- 79% of the 1,093 user reviews for this game are positive.'}"
Vampire Survivors: Operation Guns,poncle,poncle,2024-05-09,164,"['Action Roguelike', 'Bullet Hell', 'Pixel Graphics', 'Indie', 'Roguelite', '2D', 'Casual', 'Vampire', 'Action', 'Singleplayer', 'Arcade', 'RPG', 'Controller', 'Retro', 'Score Attack', 'Roguelike', 'Action RPG', 'Dark Fantasy', 'Local Co-Op', '1980s']",Description not found,22499,"{'summary': 'Very Positive', 'count': '462', 'info': '- 92% of the 462 user reviews for this game are positive.'}","{'summary': 'Very Positive', 'count': '462', 'info': '- 92% of the 462 user reviews for this game are positive.'}"
AMID EVIL,Indefatigable,New Blood Interactive,2019-06-20,1949,"['Boomer Shooter', 'Old School', 'Arena Shooter', 'Sci-fi', 'FPS', 'Magic', 'Surreal', 'Shooter', 'First-Person', 'Psychedelic', 'Action', 'Colorful', 'Fantasy', 'Dark Fantasy', 'Atmospheric', 'Adventure', 'Retro', ""1990's"", 'Combat', 'Singleplayer']",A retro FPS for the ages! Once branded a HERETIC. Now YOU have been chosen as our champion! Reclaim our sacred weapons. Take back our ancient lands. If you can stand... AMID EVIL.,144497,"{'summary': 'Very Positive', 'count': '28', 'info': '- 82% of the 28 user reviews in the last 30 days are positive.'}","{'summary': 'Very Positive', 'count': '5,987', 'info': '- 94% of the 5,987 user reviews for this game are positive.'}"
Rune Coliseum,Rafale Software,Rafale Software,2024-09-23,27,"['Early Access', 'Deckbuilding', 'Strategy', 'Roguelike', 'Card Battler', 'Card Game', 'Turn-Based Combat', 'Fighting', 'Spectacle fighter', 'Medieval', '2D Fighter', 'Action', 'RPG', 'Replay Value', 'Turn-Based Tactics', 'Dark Fantasy', 'Singleplayer', 'Comic Book', 'Martial Arts', 'Sports']","A deck-building roguelike game with unique semi-real-time combat system. Step into the shoes of an ancient gladiator and do your best to survive in the coliseum. Combine various skills and equipment, develop your own fighting style, and defeat all the enemies to become the next champion!",159999,"{'summary': 'Very Positive', 'count': '460', 'info': '- 90% of the 460 user reviews for this game are positive.'}","{'summary': 'Very Positive', 'count': '460', 'info': '- 90% of the 460 user reviews for this game are positive.'}"
Grunn,Sokpop Collective,Sokpop Collective,2024-10-04,16,"['Horror', 'Multiple Endings', 'Choices Matter', 'Simulation', 'Farming Sim', 'Adventure', 'Mystery', 'First-Person', 'Exploration', 'Investigation', 'Action-Adventure', '3D', 'Atmospheric', 'Casual', 'Indie', 'Psychological Horror', 'Story Rich', 'Singleplayer', 'Dark', 'Cinematic']","A gardener gets hired for maintenance work over the weekend. A simple task, but strangely some tools are missing…The owner of the garden isn't around, and their house is off-limits. Perhaps new tools can be found in the mysterious town, or maybe some of the reserved townsfolk have seen them?",114999,"{'summary': 'Very Positive', 'count': '330', 'info': '- 98% of the 330 user reviews for this game are positive.'}","{'summary': 'Very Positive', 'count': '330', 'info': '- 98% of the 330 user reviews for this game are positive.'}"
Gunfire Reborn - Visitors of Spirit Realm,Duoyi Games,Duoyi Games,2022-08-28,784,"['Action', 'Adventure', 'RPG', 'Indie', 'Roguelike', 'FPS', 'Online Co-Op']",Description not found,55000,"{'summary': 'Very Positive', 'count': '965', 'info': '- 90% of the 965 user reviews for this game are positive.'}","{'summary': 'Very Positive', 'count': '965', 'info': '- 90% of the 965 user reviews for this game are positive.'}"
Revolution Idle,Oni Gaming,Oni Gaming,2024-10-11,9,"['Casual', 'Simulation', 'Clicker', '2D', 'Minimalist', 'Free to Play', 'Automation', 'Futuristic', 'Management', 'Idler', 'Modern', 'Relaxing', 'Indie', 'Early Access', 'Resource Management', 'Time Manipulation', 'Singleplayer']",Join an experience where each revolution takes you further into the unknown! Revolution Idle challenges you to multiply your accumulators to reach unimaginable heights. Will you manage to reach infinity?,0,"{'summary': 'Mixed', 'count': '234', 'info': '- 63% of the 234 user reviews for this game are positive.'}","{'summary': 'Mixed', 'count': '234', 'info': '- 63% of the 234 user reviews for this game are positive.'}"
Two Point Hospital,Two Point Studios,SEGA,2018-08-29,2244,"['Simulation', 'Medical Sim', 'Management', 'Building', 'Funny', 'Singleplayer', 'Strategy', 'Sandbox', 'Indie', 'Comedy', 'Casual', 'City Builder', 'Replay Value', 'Cartoony', 'Multiplayer', 'Isometric', 'Family Friendly', 'Retro', 'Classic', 'Tactical']","Design stunning hospitals, cure peculiar illnesses and manage troublesome staff as you spread your budding healthcare organisation across Two Point County.",359999,"{'summary': 'Very Positive', 'count': '157', 'info': '- 89% of the 157 user reviews in the last 30 days are positive.'}","{'summary': 'Very Positive', 'count': '24,511', 'info': '- 92% of the 24,511 user reviews for this game are positive.'}"
9-Bit Armies: A Bit Too Far,Petroglyph,Petroglyph,2024-08-26,55,"['Action RTS', 'Wargame', 'RTS', 'Real Time Tactics', 'Sandbox', 'Colorful', 'PvP', 'Base Building', 'Strategy', 'Tactical', 'Isometric', 'Action', 'Top-Down', 'Voxel', 'Funny', 'LEGO', 'Moddable', 'Naval Combat', 'Military', 'Management']","Unleash voxel warfare in 9-Bit Armies: A Bit Too Far. Lead a modern military, build bases, unlock units, and attack in all-out war. Engage on land, sea and air in over two dozen missions, online skirmishes, or co-op. Easy to learn, a challenge to master.",48750,"{'summary': 'Mostly Positive', 'count': '41', 'info': '- 78% of the 41 user reviews in the last 30 days are positive.'}","{'summary': 'Very Positive', 'count': '653', 'info': '- 84% of the 653 user reviews for this game are positive.'}"
Moonstone Island,Studio Supersoft,Raw Fury,2023-09-20,396,"['Creature Collector', 'Deckbuilding', '2D', 'Pixel Graphics', 'Cute', 'Sandbox', 'Building', 'Card Battler', 'Farming Sim', 'Life Sim', 'Agriculture', 'RPG', 'Simulation', 'Relaxing', 'Fantasy', 'Action-Adventure', 'Strategy', 'Dating Sim', 'Cooking', 'Fishing']","Moonstone Island is a creature-collecting life-sim set in an open world with 100 islands to explore. Make friends, brew potions, collect Spirits, and test your strength in card-based encounters to complete your Alchemy training!",165999,"{'summary': 'Very Positive', 'count': '77', 'info': '- 81% of the 77 user reviews in the last 30 days are positive.'}","{'summary': 'Very Positive', 'count': '2,740', 'info': '- 85% of the 2,740 user reviews for this game are positive.'}"
Dark Deception,Glowstick Entertainment,Glowstick Entertainment,2018-09-26,2216,"['Horror', 'Free to Play', 'Multiplayer', 'Singleplayer', 'First-Person', 'Psychological Horror', 'Runner', 'Survival Horror', 'Indie', 'Action', 'Dark Humor', 'Survival', 'Adventure', 'Story Rich', 'RPG', 'Arcade', 'Multiple Endings', 'Cinematic', 'Dark', 'Difficult']","Death awaits you in Dark Deception, a story-driven first-person horror maze game. There's nowhere to hide & nowhere to catch your breath. Run or die - it's your choice. Trapped in a realm of nightmarish mazes with a mysterious woman, your only hope of survival is to find a way to escape.",0,"{'summary': 'Very Positive', 'count': '255', 'info': '- 87% of the 255 user reviews in the last 30 days are positive.'}","{'summary': 'Very Positive', 'count': '19,525', 'info': '- 89% of the 19,525 user reviews for this game are positive.'}"
Until Then,Polychroma Games,Maximum Entertainment,2024-06-25,117,"['Visual Novel', 'Pixel Graphics', 'Interactive Fiction', 'Emotional', 'Drama', '2D', 'Story Rich', 'Psychological', 'Adventure', 'Mystery', 'LGBTQ+', 'Casual', 'Linear', 'Side Scroller', 'Romance', 'Colorful', 'Foreign', 'Multiple Endings', 'Singleplayer', 'Conversation']","A fateful meeting sets off a chain reaction, upending Mark's life. People disappear and memories prove unreliable. Uncover a hidden truth with Mark and his friends in this narrative adventure and race to unravel the mystery before it's too late.",165999,"{'summary': 'Overwhelmingly Positive', 'count': '662', 'info': '- 97% of the 662 user reviews in the last 30 days are positive.'}","{'summary': 'Overwhelmingly Positive', 'count': '3,408', 'info': '- 98% of the 3,408 user reviews for this game are positive.'}"
Mini Motorways,Dinosaur Polo Club,Dinosaur Polo Club,2021-07-20,1188,"['Strategy', 'Simulation', 'Casual', 'Indie', 'Management', 'Minimalist', 'Puzzle', 'Relaxing', 'Transportation', 'Building', 'Singleplayer', 'Stylized', 'Top-Down', 'Beautiful', 'City Builder', 'Family Friendly', 'Resource Management', 'Great Soundtrack', 'Touch-Friendly', 'Roguelike']","Mini Motorways is a strategy simulation game about designing the road map for a growing city. Build a traffic network, one road at a time, to create a bustling metropolis. Redesign your roads and place your motorways to get everyone where they need to go. How long can you keep the city moving?",69999,"{'summary': 'Overwhelmingly Positive', 'count': '134', 'info': '- 96% of the 134 user reviews in the last 30 days are positive.'}","{'summary': 'Overwhelmingly Positive', 'count': '19,210', 'info': '- 96% of the 19,210 user reviews for this game are positive.'}"
