title,developer,publisher,release_date,age_in_days,tags,description,price,recent_reviews,all_reviews
Clone Drone in the Danger Zone,Doborog Games,Doborog Games,2021-07-27,1181,"['Robots', 'Action', '3D Fighter', 'Swordplay', 'Multiplayer', 'Fighting', 'Indie', 'Funny', 'Singleplayer', 'Voxel', 'Online Co-Op', 'Co-op', 'Third Person', 'Roguelike', 'Pixel Graphics', 'Futuristic', 'Difficult', 'Comedy', 'Survival', 'Dark Humor']","Clone Drone in the Danger Zone is a robot voxel slice-em-up where any part of your body can be sliced off. With your mind downloaded into a robot gladiator, you must survive the sinister trials of the arena.",0,"{'summary': 'Overwhelmingly Positive', 'count': '440', 'info': '- 97% of the 440 user reviews in the last 30 days are positive.'}","{'summary': 'Overwhelmingly Positive', 'count': '27,335', 'info': '- 96% of the 27,335 user reviews for this game are positive.'}"
Slay the Spire,Mega Crit,Mega Crit,2019-01-23,2097,"['Roguelike Deckbuilder', 'Card Game', 'Card Battler', 'Roguelike', 'Deckbuilding', 'Turn-Based', 'Strategy', 'Singleplayer', 'Roguelite', 'Replay Value', 'Indie', 'Difficult', 'Dungeon Crawler', 'RPG', 'Mouse only', '2D', 'Great Soundtrack', 'Procedural Generation', 'Fantasy', 'Casual']","We fused card games and roguelikes together to make the best single player deckbuilder we could. Craft a unique deck, encounter bizarre creatures, discover relics of immense power, and Slay the Spire!",211000,"{'summary': 'Overwhelmingly Positive', 'count': '1,452', 'info': '- 97% of the 1,452 user reviews in the last 30 days are positive.'}","{'summary': 'Overwhelmingly Positive', 'count': '143,605', 'info': '- 97% of the 143,605 user reviews for this game are positive.'}"
Escape Simulator,Pine Studio,Pine Studio,2021-10-19,1097,"['Puzzle', 'Co-op', 'Multiplayer', 'Escape Room', 'First-Person', 'Adventure', 'Controller', 'Online Co-Op', 'Mystery', 'Family Friendly', 'Casual', 'Indie', 'Singleplayer', 'Simulation', 'VR', 'Story Rich', 'Point & Click', 'Investigation', 'Exploration', 'Level Editor']","First-person puzzler you can play solo or in an online co-op (best with 2-3 players, but playable with more). Explore a set of highly interactive escape rooms. Move furniture, pick up and examine everything, smash pots and break locks! Supports community rooms through the level editor.",169000,"{'summary': 'Very Positive', 'count': '118', 'info': '- 93% of the 118 user reviews in the last 30 days are positive.'}","{'summary': 'Very Positive', 'count': '13,148', 'info': '- 94% of the 13,148 user reviews for this game are positive.'}"
RimWorld - Ideology,Ludeon Studios,Ludeon Studios,2021-07-20,1188,"['Strategy', 'Indie', 'Simulation', 'Colony Sim', 'Base Building', 'Survival', 'Management', 'Moddable']",Description not found,149999,"{'summary': 'Very Positive', 'count': '14', 'info': '- 92% of the 14 user reviews in the last 30 days are positive.'}","{'summary': 'Very Positive', 'count': '2,906', 'info': '- 83% of the 2,906 user reviews for this game are positive.'}"
The Isle,Afterthought LLC,Afterthought LLC,2015-12-01,3246,"['Dinosaurs', 'Survival', 'Open World', 'Multiplayer', 'Simulation', 'Hunting', 'Realistic', 'Massively Multiplayer', 'Adventure', 'Early Access', 'Action', 'Third Person', 'Horror', 'Co-op', 'Sandbox', 'Walking Simulator', 'Team-Based', 'Strategy', 'RPG', 'Indie']",Experience fierce open world survival gameplay as you attempt to stay alive on an unforgiving island inhabited by dinosaurs! Hunt. Grow. Survive.,135999,"{'summary': 'Very Positive', 'count': '992', 'info': '- 81% of the 992 user reviews in the last 30 days are positive.'}","{'summary': 'Very Positive', 'count': '77,585', 'info': '- 81% of the 77,585 user reviews for this game are positive.'}"
My Summer Car,Amistech Games,Amistech Games,2016-10-24,2918,"['Automobile Sim', 'Simulation', 'Driving', 'Open World', 'Survival', 'Realistic', 'First-Person', 'Building', 'Racing', 'Singleplayer', 'Funny', 'Early Access', 'Sandbox', 'Difficult', 'Perma Death', 'Comedy', 'Indie', 'Adventure', 'Multiplayer', 'Puzzle']","My Summer Car is the ultimate car owning, building, fixing, tuning, maintenance AND permadeath life survival simulator. You start the game with hundreds of loose parts and assemble both car and engine.",115999,"{'summary': 'Very Positive', 'count': '1,628', 'info': '- 94% of the 1,628 user reviews in the last 30 days are positive.'}","{'summary': 'Very Positive', 'count': '72,497', 'info': '- 94% of the 72,497 user reviews for this game are positive.'}"
Soulmask,CampFire Studio,Qooland Games,2024-05-30,143,"['Early Access', 'Survival', 'Multiplayer', 'Open World Survival Craft', 'Sandbox', 'Building', 'Open World', 'Base Building', 'Crafting', 'Third Person', 'Action-Adventure', 'Exploration', 'RPG', 'Simulation', 'Singleplayer', 'Adventure', 'Massively Multiplayer', '3D', 'Hunting', 'Realistic']","Escaping a deadly sacrificial ritual, you find an ancient mystical mask on your journey. This mask holds potent knowledge, changing the world you knew. Face the harsh challenges of nature, survive, rally followers, and build your own tribe. Explore and unveil the truths behind the enigmatic mask.",245999,"{'summary': 'Mostly Positive', 'count': '358', 'info': '- 74% of the 358 user reviews in the last 30 days are positive.'}","{'summary': 'Mostly Positive', 'count': '9,216', 'info': '- 78% of the 9,216 user reviews for this game are positive.'}"
Reus 2,Abbey Games,Firesquid,2024-05-28,145,"['God Game', 'Colony Sim', 'City Builder', 'Base Building', 'Resource Management', 'Management', 'Strategy', 'Turn-Based', 'Sandbox', 'Nature', 'Life Sim', 'Simulation', '2D', 'Relaxing', 'Building', 'Singleplayer', 'Colorful', 'Indie', 'Adventure', 'Exploration']","Shape worlds with your godly titans. Make symbiotic ecosystems and inspire humanity with your creations. Their achievements unlock new possibilities. Make different planets for different human spirits, and fill the universe with life!",66600,"{'summary': 'Very Positive', 'count': '63', 'info': '- 92% of the 63 user reviews in the last 30 days are positive.'}","{'summary': 'Overwhelmingly Positive', 'count': '1,170', 'info': '- 95% of the 1,170 user reviews for this game are positive.'}"
ARK: Survival Evolved,Studio Wildcard,Studio Wildcard,2017-08-27,2611,"['Open World Survival Craft', 'Survival', 'Multiplayer', 'Open World', 'Dinosaurs', 'Crafting', 'Building', 'Adventure', 'Base Building', 'Co-op', 'Action', 'First-Person', 'Sandbox', 'Massively Multiplayer', 'Singleplayer', 'Early Access', 'RPG', 'Dragons', 'Sci-fi', 'Indie']","Stranded on the shores of a mysterious island, you must learn to survive. Use your cunning to kill or tame the primeval creatures roaming the land, and encounter other players to survive, dominate... and escape!",130999,"{'summary': 'Very Positive', 'count': '2,640', 'info': '- 91% of the 2,640 user reviews in the last 30 days are positive.'}","{'summary': 'Very Positive', 'count': '529,875', 'info': '- 83% of the 529,875 user reviews for this game are positive.'}"
Mount & Blade II: Bannerlord,TaleWorlds Entertainment,TaleWorlds Entertainment,2022-10-25,726,"['Medieval', 'Strategy', 'Open World', 'RPG', 'War', 'Sandbox', 'Multiplayer', 'Singleplayer', 'Action', 'Character Customization', 'Simulation', 'Moddable', 'Adventure', 'Horses', 'Realistic', 'Third Person', 'Historical', 'First-Person', 'Great Soundtrack', 'Early Access']","A strategy/action RPG. Create a character, engage in diplomacy, craft, trade and conquer new lands in a vast medieval sandbox. Raise armies to lead into battle and command and fight alongside your troops in massive real-time battles using a deep but intuitive skill-based combat system.",549000,"{'summary': 'Very Positive', 'count': '1,160', 'info': '- 87% of the 1,160 user reviews in the last 30 days are positive.'}","{'summary': 'Very Positive', 'count': '195,820', 'info': '- 87% of the 195,820 user reviews for this game are positive.'}"
Amber Isle,Ambertail Games,Team17,2024-10-10,10,"['Dinosaurs', 'Crafting', 'Management', 'Exploration', 'Life Sim', 'Cute', 'Character Customization', 'RPG', '3D', 'Third Person', 'Relaxing', 'Controller', 'Conversation', 'Casual', 'Family Friendly', 'Simulation', 'Cozy', 'Adventure', 'Singleplayer', 'Indie']","Welcome to Amber Isle - a quaint, friendly village of prehistoric residents who are in need of a new shopkeep... That’s you! Craft and sell items, upgrade your shop, befriend your Paleofolk neighbours and customise the island to bring the village back to life and welcome even more prehistoric pals!",299999,"{'summary': 'Very Positive', 'count': '652', 'info': '- 82% of the 652 user reviews for this game are positive.'}","{'summary': 'Very Positive', 'count': '652', 'info': '- 82% of the 652 user reviews for this game are positive.'}"
The Escapists 2,Team17,Team17,2017-08-21,2617,"['Multiplayer', 'Strategy', 'Pixel Graphics', 'Online Co-Op', 'Co-op', '2D', 'Crafting', 'Simulation', 'Singleplayer', 'Indie', 'Local Co-Op', 'Sandbox', 'Stealth', 'Character Customization', 'Funny', 'Puzzle', 'Split Screen', 'Open World', 'Action', 'Difficult']","Craft, Steal, Brawl and Escape! It’s time to bust out of the toughest prisons in the world as you return to the life of an inmate in The Escapists 2, now with multiplayer! Have you got what it takes to escape?",221999,"{'summary': 'Very Positive', 'count': '171', 'info': '- 87% of the 171 user reviews in the last 30 days are positive.'}","{'summary': 'Very Positive', 'count': '24,031', 'info': '- 91% of the 24,031 user reviews for this game are positive.'}"
Vault of the Void,Spider Nest Games,Spider Nest Games,2022-10-04,747,"['Indie', 'Roguelike Deckbuilder', 'Deckbuilding', 'Choices Matter', 'Strategy', 'Card Game', 'Card Battler', 'Roguelite', 'Roguelike', 'Procedural Generation', 'Early Access', 'Difficult', 'Adventure', 'Exploration', 'Board Game', '2D', 'Isometric', 'Top-Down', 'Fantasy', 'Singleplayer']","Vault of the Void is a fast-paced roguelike deckbuilder where the power is in your hands. Continuously customise your deck, crafting powerful combos and ingenious strategies. Upgrade your cards with Void Stones, infusing them with new abilities to help defeat the minions of The Void!",50248,"{'summary': 'Very Positive', 'count': '29', 'info': '- 89% of the 29 user reviews in the last 30 days are positive.'}","{'summary': 'Very Positive', 'count': '2,184', 'info': '- 92% of the 2,184 user reviews for this game are positive.'}"
The Spell Brigade,Bolt Blaster Games,Bolt Blaster Games,2024-09-16,34,"['Action Roguelike', 'Bullet Hell', 'Online Co-Op', 'Roguelite', 'Action', 'Magic', '3D', 'Dark Fantasy', 'Co-op', 'Singleplayer', 'Arcade', 'Multiplayer', 'Casual', 'Top-Down Shooter', 'Roguelike', 'Top-Down', 'Score Attack', 'Controller', 'Colorful', 'Early Access']","Survivors-like with ONLINE CO-OP for 1-4 players. Team up with your wizard friends to slay hordes of dark creatures. Complete team-based objectives, unlock new upgrades and create overpowered spell synergies. Friend nor foe is safe in this friendly fire bullet hell!",90999,"{'summary': 'Very Positive', 'count': '981', 'info': '- 86% of the 981 user reviews in the last 30 days are positive.'}","{'summary': 'Very Positive', 'count': '1,202', 'info': '- 86% of the 1,202 user reviews for this game are positive.'}"
Nodebuster,Goblobin,Goblobin,2024-08-13,68,"['Casual', 'Strategy', 'Clicker', 'Simulation', 'Idler', 'Arcade', 'Management', '2D', 'Experimental', 'Abstract', 'Relaxing', 'Minimalist', 'Colorful', 'Hacking', 'Retro', 'Pixel Graphics', 'Artificial Intelligence', 'Indie', 'Futuristic', 'Singleplayer']","Nodebuster is a short, experimental incremental game about busting nodes and destroying reality.",28999,"{'summary': 'Overwhelmingly Positive', 'count': '3,711', 'info': '- 98% of the 3,711 user reviews in the last 30 days are positive.'}","{'summary': 'Overwhelmingly Positive', 'count': '4,757', 'info': '- 98% of the 4,757 user reviews for this game are positive.'}"
Voidtrain,HypeTrain Digital,HypeTrain Digital,2023-05-09,530,"['Open World Survival Craft', 'Co-op', 'Survival', 'Multiplayer', 'Base Building', 'Crafting', 'Open World', 'Online Co-Op', 'Adventure', 'First-Person', 'Exploration', 'Building', 'Atmospheric', 'Singleplayer', 'Sandbox', 'Action', 'Simulation', 'Early Access', 'Trains', 'Indie']","Become a crew member of an Interdimensional Express Train! Discover a new world full of mysterious creatures, enemies and places. Upgrade and customize your train, gather new materials and build better weapons. Play solo or online сo-op with up to 4 people.",91699,"{'summary': 'Very Positive', 'count': '121', 'info': '- 80% of the 121 user reviews in the last 30 days are positive.'}","{'summary': 'Mostly Positive', 'count': '4,472', 'info': '- 73% of the 4,472 user reviews for this game are positive.'}"
Spirit of the North,Infuse Studio,Merge Games,2020-05-07,1627,"['Adventure', 'Indie', 'Casual', 'Exploration', 'Puzzle', 'Relaxing', 'Fox', 'Experience', 'Atmospheric', 'Great Soundtrack', 'Singleplayer', '3D', 'Walking Simulator', 'Beautiful', 'Third Person', 'Platformer', 'Multiplayer', '3D Platformer']","Spirit of the North is a single-player 3rd-person adventure game inspired by the breathtaking and mysterious landscapes of Iceland. Play as an ordinary red fox whose story becomes entwined with the guardian of the Northern Lights, a female spirit fox.",0,"{'summary': 'Mostly Positive', 'count': '89', 'info': '- 77% of the 89 user reviews in the last 30 days are positive.'}","{'summary': 'Very Positive', 'count': '3,680', 'info': '- 86% of the 3,680 user reviews for this game are positive.'}"
Squirrel with a Gun,Dee Dee Creations LLC,Maximum Entertainment,2024-08-29,52,"['Action', 'Simulation', 'Third-Person Shooter', 'Sandbox', 'Shooter', 'Platformer', 'Action-Adventure', '3D Platformer', 'Collectathon', 'Exploration', ""Shoot 'Em Up"", '3D', 'Cartoony', 'Cute', 'America', 'Third Person', 'Comedy', 'Funny', 'Memes', 'Conspiracy']","Squirrel, meet gun. As the neighborhood’s most obnoxious rodent, develop a knack (and a love?) for crime and mayhem in pursuit of golden acorns in this nutty sandbox shooter and puzzle platformer. Fight tooth, claw, and gun to escape a secret underground facility and defeat the Agents.",0,"{'summary': 'Very Positive', 'count': '317', 'info': '- 88% of the 317 user reviews in the last 30 days are positive.'}","{'summary': 'Very Positive', 'count': '1,604', 'info': '- 85% of the 1,604 user reviews for this game are positive.'}"
RimWorld - Biotech,Ludeon Studios,Ludeon Studios,2022-10-21,730,"['Indie', 'Strategy', 'Simulation', 'Colony Sim', 'Singleplayer', 'Moddable', 'Sci-fi']",Description not found,179999,"{'summary': 'Very Positive', 'count': '18', 'info': '- 83% of the 18 user reviews in the last 30 days are positive.'}","{'summary': 'Very Positive', 'count': '2,622', 'info': '- 92% of the 2,622 user reviews for this game are positive.'}"
The Long Dark,Hinterland Studio Inc.,Hinterland Studio Inc.,2017-08-01,2637,"['Survival', 'Open World Survival Craft', 'Open World', 'Exploration', 'Atmospheric', 'Singleplayer', 'First-Person', 'Adventure', 'Crafting', 'Sandbox', 'Simulation', 'Post-apocalyptic', 'Indie', 'Walking Simulator', 'Survival Horror', 'Strategy', 'Difficult', 'Action', 'Early Access', 'Co-op']","THE LONG DARK is a thoughtful, exploration-survival experience that challenges solo players to think for themselves as they explore an expansive frozen wilderness in the aftermath of a geomagnetic disaster. There are no zombies -- only you, the cold, and all the threats Mother Nature can muster.",270100,"{'summary': 'Very Positive', 'count': '390', 'info': ""- 90% of the 390 user reviews in the last 30 days are positive.This product has experienced one or more periods of off-topic review activity.  Based on your preferences, the reviews within these periods have been excluded from this product's Review Score.""}","{'summary': 'Very Positive', 'count': '92,225', 'info': ""- 91% of the 92,225 user reviews for this game are positive.This product has experienced one or more periods of off-topic review activity.  Based on your preferences, the reviews within these periods have been excluded from this product's Review Score.""}"
Slime Rancher 2,Monomi Park,Monomi Park,2022-09-22,759,"['Early Access', 'Cute', 'Relaxing', 'Colorful', 'Open World', 'Singleplayer', 'First-Person', 'Creature Collector', 'Adventure', 'Simulation', 'Family Friendly', 'Casual', 'Female Protagonist', '3D', 'Fantasy', 'Building', 'Multiplayer', 'Action-Adventure', 'FPS', 'Action']","Continue the adventures of Beatrix LeBeau as she journeys across the Slime Sea to Rainbow Island, a land brimming with ancient mysteries, and bursting with wiggly, new slimes to wrangle in this sequel to the smash-hit, Slime Rancher.",63375,"{'summary': 'Very Positive', 'count': '340', 'info': '- 90% of the 340 user reviews in the last 30 days are positive.'}","{'summary': 'Very Positive', 'count': '26,103', 'info': '- 94% of the 26,103 user reviews for this game are positive.'}"
Wreckfest,Bugbear,THQ Nordic,2018-06-14,2320,"['Racing', 'Destruction', 'Automobile Sim', 'Simulation', 'Multiplayer', 'Driving', 'Physics', 'Action', 'Indie', 'Sports', 'Singleplayer', 'Realistic', 'Funny', 'Arcade', 'Early Access', 'Sandbox', 'Third Person', 'Co-op', 'Open World', 'Atmospheric']","Wreckfest is a demolition derby themed racing game with soft-body damage modeling, sophisticated driving dynamics and in-depth vehicle upgrading, featuring both demolition derbies and more traditional track races. It’s all about fun, breakneck racing and over-the-top crashes.",295843,"{'summary': 'Very Positive', 'count': '147', 'info': '- 90% of the 147 user reviews in the last 30 days are positive.'}","{'summary': 'Very Positive', 'count': '27,957', 'info': '- 87% of the 27,957 user reviews for this game are positive.'}"
Recycling Center Simulator,Balas Games,PlayWay S.A.,2024-10-02,18,"['First-Person', 'Simulation', 'Management', 'Time Management', 'Life Sim', 'Immersive Sim', 'Sandbox', 'Economy', 'Automation', 'Building', 'Physics', '3D', 'Capitalism', 'Realistic', 'Crafting', 'Relaxing', 'Resource Management', 'Casual', 'Adventure', 'Family Friendly']","Recycling Center Simulator is a business simulator game with a first person view. Make money from garbage, collect raw materials for your recycling center from different locations, recycle them, make money by producing new products and improve your factory.",130000,"{'summary': 'Very Positive', 'count': '530', 'info': '- 83% of the 530 user reviews for this game are positive.'}","{'summary': 'Very Positive', 'count': '530', 'info': '- 83% of the 530 user reviews for this game are positive.'}"
Drug Dealer Simulator 2,Byterunners,Movie Games S.A.,2024-06-20,122,"['Open World', 'Multiplayer', 'Simulation', 'Singleplayer', 'Action', 'First-Person', 'Crime', 'RPG', 'Sandbox', 'Inventory Management', 'Atmospheric', 'Adventure', 'Mature', 'Co-op Campaign', 'Resource Management', 'Crafting', 'Management', '3D', 'Realistic', 'Trading']","What turns a person into a drug dealer? A drug dealer into a drug lord? Find out in DDS2, a first-person co-op sim set in a dynamic open world. Make contacts, cook drugs, and manage your cartel on Isla Sombra, where power is the only law.",206999,"{'summary': 'Mixed', 'count': '182', 'info': '- 65% of the 182 user reviews in the last 30 days are positive.'}","{'summary': 'Mostly Positive', 'count': '3,688', 'info': '- 70% of the 3,688 user reviews for this game are positive.'}"
Blade and Sorcery,WarpFrog,WarpFrog,2024-06-17,125,"['VR', 'Swordplay', 'Moddable', 'Action', 'Gore', 'Magic', 'Sandbox', 'Violent', 'Physics', 'Simulation', 'Medieval', 'Fighting', 'First-Person', 'Singleplayer', 'Fantasy', 'Adventure', 'RPG', 'Indie', 'Early Access', 'Games Workshop']","Blade & Sorcery is a built-for-VR medieval fantasy with full physics driven melee, ranged and magic combat. Become a powerful warrior, ranger or sorcerer and devastate your enemies.",245999,"{'summary': 'Very Positive', 'count': '580', 'info': '- 92% of the 580 user reviews in the last 30 days are positive.'}","{'summary': 'Overwhelmingly Positive', 'count': '50,754', 'info': '- 96% of the 50,754 user reviews for this game are positive.'}"
IdleOn - The Idle RPG,Lavaflame2,Lavaflame2,2021-04-02,1297,"['Idler', 'Management', 'Pixel Graphics', 'MMORPG', 'Free to Play', 'RPG', 'Clicker', 'Crafting', 'Multiplayer', 'Resource Management', 'Sandbox', 'Massively Multiplayer', 'Indie', 'Casual', 'Simulation', 'Character Customization', 'Early Access', 'Old School', 'PvE', 'Cute']","The RPG where all your characters grind for you! Choose classes as they level up, and spend their loot to gain more power... but don't let the simple graphics fool you, IdleOn gets more complex as you progress!",0,"{'summary': 'Very Positive', 'count': '247', 'info': '- 80% of the 247 user reviews in the last 30 days are positive.'}","{'summary': 'Mostly Positive', 'count': '18,032', 'info': '- 78% of the 18,032 user reviews for this game are positive.'}"
RimWorld - Anomaly,Ludeon Studios,Ludeon Studios,2024-04-11,192,"['Colony Sim', 'Base Building', 'Survival', 'Strategy', 'Sandbox', 'Management', 'Building', 'Simulation', 'Singleplayer', 'Moddable', 'City Builder', 'Open World', 'Procedural Generation', '2D', 'Indie', 'Sci-fi', 'Space', 'Tactical RPG', 'Western', 'Cartoony']",Description not found,179999,"{'summary': 'Mixed', 'count': '45', 'info': '- 60% of the 45 user reviews in the last 30 days are positive.'}","{'summary': 'Very Positive', 'count': '2,267', 'info': '- 84% of the 2,267 user reviews for this game are positive.'}"
Dome Keeper,Bippinbits,Raw Fury,2022-09-27,754,"['Singleplayer', 'Post-apocalyptic', 'Roguelike', 'Action', 'Sci-fi', 'Combat', 'Resource Management', 'Atmospheric', 'Space', 'Procedural Generation', 'Physics', 'Retro', 'Pixel Graphics', 'Replay Value', 'Tower Defense', 'Exploration', 'Controller', '2D', 'Tactical', 'Adventure']",Defend against waves of alien attackers in this innovative roguelike survival miner. Dig for resources and choose from powerful upgrade paths. Is there enough time to mine a little deeper and get back to defend before the monsters attack your dome?,73098,"{'summary': 'Very Positive', 'count': '288', 'info': '- 93% of the 288 user reviews in the last 30 days are positive.'}","{'summary': 'Very Positive', 'count': '12,103', 'info': '- 91% of the 12,103 user reviews for this game are positive.'}"
PICO PARK,TECOPARK,TECOPARK,2021-05-07,1262,"['Multiplayer', 'Online Co-Op', 'Puzzle Platformer', 'Co-op', 'Casual', 'Cute', 'Local Co-Op', 'Local Multiplayer', 'Platformer', '2D', 'Action', 'Pixel Graphics', 'Funny', 'Indie', 'Puzzle', 'Party Game', 'Retro', 'Horror', 'Difficult', 'Souls-like']",PICO PARK is a cooperative local/online multiplay action puzzle game for 2-8 players.,39999,"{'summary': 'Very Positive', 'count': '287', 'info': '- 91% of the 287 user reviews in the last 30 days are positive.'}","{'summary': 'Very Positive', 'count': '21,175', 'info': '- 91% of the 21,175 user reviews for this game are positive.'}"
Crosshair X,CenterPoint Gaming,CenterPoint Gaming,2020-06-01,1602,"['Action', 'Indie', 'Adventure', 'Utilities', 'Shooter', 'Software', 'FPS', 'Game Development', 'Design & Illustration', 'Photo Editing', 'Animation & Modeling', 'Survival', 'Education', 'PvP', 'First-Person', 'Third-Person Shooter', 'War', 'Sandbox', 'Tactical', 'Third Person']",Overlay custom crosshairs on every game you play. Choose from thousands of unique crosshairs created by the Crosshair X community or design your own using the designer.,56999,"{'summary': 'Very Positive', 'count': '1,049', 'info': '- 94% of the 1,049 user reviews in the last 30 days are positive.'}","{'summary': 'Very Positive', 'count': '19,869', 'info': '- 92% of the 19,869 user reviews for this software are positive.'}"
A Little to the Left,Max Inferno,Secret Mode,2022-11-08,712,"['Puzzle', 'Relaxing', 'Wholesome', 'Casual', 'Cute', 'Cozy', 'Logic', 'Cats', '2D', 'Colorful', 'Funny', 'Singleplayer', 'Indie', 'Hand-drawn', 'Hidden Object', 'Linear', 'Family Friendly', 'Pixel Graphics', 'Point & Click', 'Psychological Horror']","A Little to the Left is a cozy puzzle game that has you sort, stack, and organize household items into pleasing arrangements while you keep an eye out for a mischievous cat with an inclination for chaos. Check out this playful and intuitive puzzler with 100+ satisfying messes to tidy.",129999,"{'summary': 'Very Positive', 'count': '261', 'info': '- 94% of the 261 user reviews in the last 30 days are positive.'}","{'summary': 'Very Positive', 'count': '9,905', 'info': '- 92% of the 9,905 user reviews for this game are positive.'}"
Path of Exile,Grinding Gear Games,Grinding Gear Games,2013-10-23,4015,"['Free to Play', 'Dark Fantasy', 'Action RPG', 'Hack and Slash', 'Loot', 'MMORPG', 'Multiplayer', 'Dungeon Crawler', 'Isometric', 'Character Customization', 'RPG', 'Inventory Management', 'Singleplayer', 'Online Co-Op', 'Action', 'PvP', 'Horror', 'Massively Multiplayer', 'Fantasy', 'Adventure']","You are an Exile, struggling to survive on the dark continent of Wraeclast, as you fight to earn power that will allow you to exact your revenge against those who wronged you. Path of Exile is an online Action RPG set in a dark fantasy world. The game is completely free and will never be pay-to-win.",0,"{'summary': 'Very Positive', 'count': '937', 'info': '- 88% of the 937 user reviews in the last 30 days are positive.'}","{'summary': 'Very Positive', 'count': '226,864', 'info': '- 89% of the 226,864 user reviews for this game are positive.'}"
